<t:root xmlns:t='test' xmlns:xsi='http://www.w3.org/2001/XMLSchema-instance' xsi:schemaLocation='test test.xsd'><record orange="0" apple="true"><int>42</int><double>42345.4232</double><name>name123_45</name><choice1>1 choice</choice1><enum>romance</enum></record><record orange="1"><int>42</int><double>42345.4232</double><name>name123_45</name><string>one two three</string><choice2>2 choice</choice2><enum>fiction</enum></record><record orange="2" apple="true"><int>42</int><double>42345.4232</double><name>name123_45</name><choice3>3 choice</choice3><enum>horror</enum></record><record orange="3"><int>42</int><double>42345.4232</double><name>name123_45</name><string>one two three</string><choice4>4 choice</choice4><enum>history</enum></record><record orange="4" apple="true"><int>42</int><double>42345.4232</double><name>name123_45</name><choice1>1 choice</choice1><enum>philosophy</enum></record><record orange="5"><int>42</int><double>42345.4232</double><name>name123_45</name><string>one two three</string><choice2>2 choice</choice2><enum>romance</enum></record><record orange="6" apple="true"><int>42</int><double>42345.4232</double><name>name123_45</name><choice3>3 choice</choice3><enum>fiction</enum></record><record orange="7"><int>42</int><double>42345.4232</double><name>name123_45</name><string>one two three</string><choice4>4 choice</choice4><enum>horror</enum></record><record orange="8" apple="true"><int>42</int><double>42345.4232</double><name>name123_45</name><choice1>1 choice</choice1><enum>history</enum></record><record orange="9"><int>42</int><double>42345.4232</double><name>name123_45</name><string>one two three</string><choice2>2 choice</choice2><enum>philosophy</enum></record><record orange="10" apple="true"><int>42</int><double>42345.4232</double><name>name123_45</name><choice3>3 choice</choice3><enum>romance</enum></record><record orange="11"><int>42</int><double>42345.4232</double><name>name123_45</name><string>one two three</string><choice4>4 choice</choice4><enum>fiction</enum></record><record orange="12" apple="true"><int>42</int><double>42345.4232</double><name>name123_45</name><choice1>1 choice</choice1><enum>horror</enum></record><record orange="13"><int>42</int><double>42345.4232</double><name>name123_45</name><string>one two three</string><choice2>2 choice</choice2><enum>history</enum></record><record orange="14" apple="true"><int>42</int><double>42345.4232</double><name>name123_45</name><choice3>3 choice</choice3><enum>philosophy</enum></record><record orange="15"><int>42</int><double>42345.4232</double><name>name123_45</name><string>one two three</string><choice4>4 choice</choice4><enum>romance</enum></record><record orange="16" apple="true"><int>42</int><double>42345.4232</double><name>name123_45</name><choice1>1 choice</choice1><enum>fiction</enum></record><record orange="17"><int>42</int><double>42345.4232</double><name>name123_45</name><string>one two three</string><choice2>2 choice</choice2><enum>horror</enum></record><record orange="18" apple="true"><int>42</int><double>42345.4232</double><name>name123_45</name><choice3>3 choice</choice3><enum>history</enum></record><record orange="19"><int>42</int><double>42345.4232</double><name>name123_45</name><string>one two three</string><choice4>4 choice</choice4><enum>philosophy</enum></record><record orange="20" apple="true"><int>42</int><double>42345.4232</double><name>name123_45</name><choice1>1 choice</choice1><enum>romance</enum></record><record orange="21"><int>42</int><double>42345.4232</double><name>name123_45</name><string>one two three</string><choice2>2 choice</choice2><enum>fiction</enum></record><record orange="22" apple="true"><int>42</int><double>42345.4232</double><name>name123_45</name><choice3>3 choice</choice3><enum>horror</enum></record><record orange="23"><int>42</int><double>42345.4232</double><name>name123_45</name><string>one two three</string><choice4>4 choice</choice4><enum>history</enum></record><record orange="24" apple="true"><int>42</int><double>42345.4232</double><name>name123_45</name><choice1>1 choice</choice1><enum>philosophy</enum></record><record orange="25"><int>42</int><double>42345.4232</double><name>name123_45</name><string>one two three</string><choice2>2 choice</choice2><enum>romance</enum></record><record orange="26" apple="true"><int>42</int><double>42345.4232</double><name>name123_45</name><choice3>3 choice</choice3><enum>fiction</enum></record><record orange="27"><int>42</int><double>42345.4232</double><name>name123_45</name><string>one two three</string><choice4>4 choice</choice4><enum>horror</enum></record><record orange="28" apple="true"><int>42</int><double>42345.4232</double><name>name123_45</name><choice1>1 choice</choice1><enum>history</enum></record><record orange="29"><int>42</int><double>42345.4232</double><name>name123_45</name><string>one two three</string><choice2>2 choice</choice2><enum>philosophy</enum></record><record orange="30" apple="true"><int>42</int><double>42345.4232</double><name>name123_45</name><choice3>3 choice</choice3><enum>romance</enum></record><record orange="31"><int>42</int><double>42345.4232</double><name>name123_45</name><string>one two three</string><choice4>4 choice</choice4><enum>fiction</enum></record><record orange="32" apple="true"><int>42</int><double>42345.4232</double><name>name123_45</name><choice1>1 choice</choice1><enum>horror</enum></record><record orange="33"><int>42</int><double>42345.4232</double><name>name123_45</name><string>one two three</string><choice2>2 choice</choice2><enum>history</enum></record><record orange="34" apple="true"><int>42</int><double>42345.4232</double><name>name123_45</name><choice3>3 choice</choice3><enum>philosophy</enum></record><record orange="35"><int>42</int><double>42345.4232</double><name>name123_45</name><string>one two three</string><choice4>4 choice</choice4><enum>romance</enum></record><record orange="36" apple="true"><int>42</int><double>42345.4232</double><name>name123_45</name><choice1>1 choice</choice1><enum>fiction</enum></record><record orange="37"><int>42</int><double>42345.4232</double><name>name123_45</name><string>one two three</string><choice2>2 choice</choice2><enum>horror</enum></record><record orange="38" apple="true"><int>42</int><double>42345.4232</double><name>name123_45</name><choice3>3 choice</choice3><enum>history</enum></record><record orange="39"><int>42</int><double>42345.4232</double><name>name123_45</name><string>one two three</string><choice4>4 choice</choice4><enum>philosophy</enum></record><record orange="40" apple="true"><int>42</int><double>42345.4232</double><name>name123_45</name><choice1>1 choice</choice1><enum>romance</enum></record><record orange="41"><int>42</int><double>42345.4232</double><name>name123_45</name><string>one two three</string><choice2>2 choice</choice2><enum>fiction</enum></record><record orange="42" apple="true"><int>42</int><double>42345.4232</double><name>name123_45</name><choice3>3 choice</choice3><enum>horror</enum></record><record orange="43"><int>42</int><double>42345.4232</double><name>name123_45</name><string>one two three</string><choice4>4 choice</choice4><enum>history</enum></record><record orange="44" apple="true"><int>42</int><double>42345.4232</double><name>name123_45</name><choice1>1 choice</choice1><enum>philosophy</enum></record><record orange="45"><int>42</int><double>42345.4232</double><name>name123_45</name><string>one two three</string><choice2>2 choice</choice2><enum>romance</enum></record><record orange="46" apple="true"><int>42</int><double>42345.4232</double><name>name123_45</name><choice3>3 choice</choice3><enum>fiction</enum></record><record orange="47"><int>42</int><double>42345.4232</double><name>name123_45</name><string>one two three</string><choice4>4 choice</choice4><enum>horror</enum></record><record orange="48" apple="true"><int>42</int><double>42345.4232</double><name>name123_45</name><choice1>1 choice</choice1><enum>history</enum></record><record orange="49"><int>42</int><double>42345.4232</double><name>name123_45</name><string>one two three</string><choice2>2 choice</choice2><enum>philosophy</enum></record><record orange="50" apple="true"><int>42</int><double>42345.4232</double><name>name123_45</name><choice3>3 choice</choice3><enum>romance</enum></record><record orange="51"><int>42</int><double>42345.4232</double><name>name123_45</name><string>one two three</string><choice4>4 choice</choice4><enum>fiction</enum></record><record orange="52" apple="true"><int>42</int><double>42345.4232</double><name>name123_45</name><choice1>1 choice</choice1><enum>horror</enum></record><record orange="53"><int>42</int><double>42345.4232</double><name>name123_45</name><string>one two three</string><choice2>2 choice</choice2><enum>history</enum></record><record orange="54" apple="true"><int>42</int><double>42345.4232</double><name>name123_45</name><choice3>3 choice</choice3><enum>philosophy</enum></record><record orange="55"><int>42</int><double>42345.4232</double><name>name123_45</name><string>one two three</string><choice4>4 choice</choice4><enum>romance</enum></record><record orange="56" apple="true"><int>42</int><double>42345.4232</double><name>name123_45</name><choice1>1 choice</choice1><enum>fiction</enum></record><record orange="57"><int>42</int><double>42345.4232</double><name>name123_45</name><string>one two three</string><choice2>2 choice</choice2><enum>horror</enum></record><record orange="58" apple="true"><int>42</int><double>42345.4232</double><name>name123_45</name><choice3>3 choice</choice3><enum>history</enum></record><record orange="59"><int>42</int><double>42345.4232</double><name>name123_45</name><string>one two three</string><choice4>4 choice</choice4><enum>philosophy</enum></record><record orange="60" apple="true"><int>42</int><double>42345.4232</double><name>name123_45</name><choice1>1 choice</choice1><enum>romance</enum></record><record orange="61"><int>42</int><double>42345.4232</double><name>name123_45</name><string>o